[
  {
    "schema": "task-dispatch/1",
    "ssot_id": "swarmbench-01-a89a470b619a",
    "task_id": "swarmbench-01-backtest",
    "slice_id": "sb01--runner-map",
    "agent_type": "runner",
    "slice_kind": "probe",
    "timebox_minutes": 4,
    "task_contract": {
      "goal": "Plan lock/dedup follow-up slices.",
      "acceptance": [
        "Return deterministic handoff requests."
      ],
      "constraints": [
        "Read-only"
      ]
    }
  },
  {
    "schema": "task-dispatch/1",
    "ssot_id": "swarmbench-01-a89a470b619a",
    "task_id": "swarmbench-01-backtest",
    "slice_id": "sb01--runner-failure",
    "agent_type": "runner",
    "timebox_minutes": 4,
    "task_contract": {
      "goal": "Exercise retry handling.",
      "acceptance": [
        "Retry once, then finish."
      ],
      "constraints": [
        "Read-only"
      ]
    }
  },
  {
    "schema": "task-dispatch/1",
    "ssot_id": "swarmbench-01-a89a470b619a",
    "task_id": "swarmbench-01-backtest",
    "slice_id": "sb01--builder-long",
    "agent_type": "builder",
    "work_package_id": "pkg-builder-long",
    "timebox_minutes": 12,
    "ownership_paths": [
      "/tmp/swarmbench-01/alpha"
    ],
    "task_contract": {
      "goal": "Provide the long builder branch.",
      "acceptance": [
        "Runs in parallel with the short branch."
      ],
      "constraints": [
        "Only edit owned paths"
      ]
    }
  },
  {
    "schema": "task-dispatch/1",
    "ssot_id": "swarmbench-01-a89a470b619a",
    "task_id": "swarmbench-01-backtest",
    "slice_id": "sb01--builder-short",
    "agent_type": "builder",
    "work_package_id": "pkg-builder-short",
    "timebox_minutes": 6,
    "ownership_paths": [
      "/tmp/swarmbench-01/beta"
    ],
    "task_contract": {
      "goal": "Provide the short builder branch.",
      "acceptance": [
        "Unblocks the dependent builder slice."
      ],
      "constraints": [
        "Only edit owned paths"
      ]
    }
  },
  {
    "schema": "task-dispatch/1",
    "ssot_id": "swarmbench-01-a89a470b619a",
    "task_id": "swarmbench-01-backtest",
    "slice_id": "sb01--builder-after-short",
    "agent_type": "builder",
    "work_package_id": "pkg-builder-after-short",
    "timebox_minutes": 6,
    "ownership_paths": [
      "/tmp/swarmbench-01/gamma"
    ],
    "dependencies": [
      "sb01--builder-short"
    ],
    "task_contract": {
      "goal": "Prove wait-any replenishment.",
      "acceptance": [
        "Starts as soon as sb01--builder-short is done."
      ],
      "constraints": [
        "Only edit owned paths"
      ]
    }
  }
]
